{
  "patch_id": "patch-unlicensed-character-001",
  "world_id": "earth2-three-cell",
  "parent_world_hash": "sha256:768ef690dfbef0d066cc53bb699e39fed1492b227e6cd0602f6fc078912fb673",
  "proposer": "claude-fable-5-1 (rung 1 of the demo ladder)",
  "created_at": "2026-09-04T21:30:00Z",
  "status": "accepted",
  "accepted_by": "fixture-human-reviewer",
  "accepted_at": "2026-09-04T21:31:00Z",
  "seed": 42,
  "rationale": "Negative test: a character whose rights record does not exist must be refused by the compiler.",
  "rights_manifest_id": "rights-three-cells-huginn-001",
  "operations": [
    {
      "op": "add",
      "target_kind": "node",
      "target_id": "settlement-river-01",
      "path": "/characters",
      "value": [
        {
          "asset": "huginn",
          "rights_item_id": "no-such-record",
          "place": "river-bank",
          "pose": "armchair",
          "facing_deg": 0,
          "offset": [
            0.075,
            -0.02
          ]
        }
      ],
      "rationale": "Huginn sits in his armchair on the top of the bank beside the road down to the river, facing the water; facing_deg 0 means facing the river, the town behind him."
    }
  ]
}